{
  "patternId": "DashboardPage",
  "name": "Dashboard Page",
  "description": "Standard dashboard layout drawn from the current production dashboard.",
  "layoutId": "AppLayout",
  "regions": [
    { "slot": "header", "element": "AppBar" },
    { "slot": "sidebar", "element": "NavList" },
    { "slot": "main", "element": "DataTable" },
    { "slot": "footer", "element": "StatusBar" }
  ],
  "sourceApp": "production-dashboard",
  "sourceVersion": "2.1.0"
}
